{
  "$schema": "../project.schema.json",
  "id": "rules-scala",
  "name": "Rules Scala",
  "buildTool": "bazel",
  "repository": "bazel-contrib/rules_scala",
  "ref": "master",
  "projectRoot": ".",
  "scenarios": [
    {
      "id": "import-encoded-target-names",
      "kind": "mbt-import",
      "openFile": "test/coverage_filename_encoding/A1.scala",
      "namespaceMode": "each-build-target",
      "required": true,
      "assertions": {
        "minimumNamespaces": 1,
        "sources": [
          "test/coverage_filename_encoding/A1.scala"
        ]
      }
    }
  ]
}
